,word,sen1,sen2,sen3,choice1,choice2,choice3
373,unwieldy,The synthetic method employed by him was too unwieldy for common use.,"Its huge size makes it awkward and unwieldy, so the supposed practicality of it is completely negated.",It can be unwieldy to run with multiple partners ' meetings.,elated,clumsy,cumbersome
374,mangy,"This was not a mangy or vicious creature standing before him, but a breathtakingly beautiful, gigantic wolf.",Luckily there was this wierd looking pensioner standing next to me with a couple of mangy mutts on a bit of rope.,"Add to that, the fact that most of the creatures are very dog-like in appearance, (or in one case, rodent-like) and there is a good chance that what is really in the pictures is either a mangy coyote or large rodent.",grotesque,filthy,hygienic
375,torpor,"The revival of the Czechs after a hundred years of torpor, due to the loss of their independence in 1620 and subsequent oppression at the hands of the Habsburgs and the dominant Germans, gave birth, from 1780 onwards, to a literary activity which still continues to yield rich fruit.","Even during the summer, bats can enter torpor during cool spells.","Gradually people became sick of openly avowed gallantry, of shameless libertinism, of moral obliquity and of the flattering artifices of vice; a long shudder ran through the selfish torpor of the social body.",heady,numbness,vigor
376,penury,"The result of his experiments was that he found himself completely impoverished, and lived in penury for the remainder of his life.","As the war went on the naval power of the Greeks diminished, partly owing to the penury of their treasury, and partly to the growth of piracy in the general anarchy of the Eastern Mediterranean.",But during the greater part of his reign he was the puppet of the magnates and kept in such penury that he was often obliged to pawn his jewels to get proper food and clothing.,grotesque,poverty,want
377,puerile,"It is usual for children to act puerile, but in adults it seems ridiculous.","James, stop making such puerile excuses.",I cannot condone such puerile activity in this place of business.,perepetual,tender,juvenile
378,subpoena,"However, Brennan thought a subpoena might force them to respond.","Not yet, but if they subpoena me, I'll have no choice but to admit I've talked with you.",A motion to quash a subpoena shall be filed in the appropriate United States district court or State court.,advisement,summons,cite
379,apotheosis,"The city is in many ways a cultural feast, the very apotheosis of hybridity.","Apotheosis can mean nothing to those who hold that a man may be reborn as a god, but still needs redemption, and that men on earth may win redemption, if they are brave enough.","If this were the case, the whole group would have represented the apotheosis (becoming a god) of Maussollos.",comparison,praise,worship
380,avow,"In 1795 he married her privately, but did not avow his marriage till 1802.",It's because they do not more boldly avow God.,"The earlier phases of the French Revolution excited his deepest sympathy, a sympathy which induced him to avow his strong; disapproval of the war with France.",agree,grant,announce
381,distract,Just sit back and don't distract me.,She tried to push the thought away and distract herself by wandering the mansion.,"Deidre set down the journal, needing to distract her thoughts before she started to panic again.",snatch,divert,perturb
382,divine,"Several churches of different denominations are open, and divine service is performed in them unhindered.",The kings claimed independent divine origin.,In the earliest days the Church was regarded as a divine.,soothsay,remarkable,prognosticate
383,knell,Every second the Prussians rung the knell of death with their artillery.,"Toll on, thou passing bell; Ring out my doleful knell; Let thy sound my death tell.","They name thee before me, A knell to mine ear; A shudder comes o'er me... Why wert thou so dear?",threat,bell,portentousness
384,remunerative,"The production is small, but would be increased at remunerative prices.","There can be no doubt that this expenditure is remunerative, since many rich regions of Asia Minor have long suffered from want of population.","The conclusion supported by most evidence seems to be that he practised on his friends and dependants, but not as a remunerative profession.",lavish,economical,profitable
385,grimace,"Prince Andrew stopped and made a grimace, as if expecting something unpleasant.",She shifted with a grimace and looked down at the brush of grass against her hands.,His mouth twitched in a pained grimace.,quince,moue,grin
386,zephyr,"As the earth of light has five tokens (the mild zephyr, cooling wind, bright light, quickening fire, and clear water), so has the earth of darkness also five (mist, heat, the sirocco, darkness and vapour).",It started as the faintest whiff - the merest zephyr of cat shite wafting up my nose.,"The sun shone for him, too, and the wind died down to little more than a gentle zephyr.",screw,breeze,cyclone
387,milieu,"The semi-Asiatic kingdom of Astrakhan, where the whole atmosphere was predatory and nine-tenths of the population were nomadic, was the natural milieu for such a rebellion as Stenka Razin's.",Modes of masculinity varied considerably according to the social milieu into which one was born.,"Dora Scott was born in 1885, and grew up amidst the Scott family's literary and artistic milieu.",nation,surrounding,condition
388,entrepreneur,"In the past, success relied heavily on whether an entrepreneur could move an offline experience online better than someone else.","Working as a home-based entrepreneur can be very rewarding, personally and financially, if you have the right concept, a good business plan, and are willing to put in the work and energy necessary to build a successful business.",I cannot overestimate the hold an original product idea has on an entrepreneur's mind.,cellar,contractor,venturer
389,gerontology,"However, gerontology researchers have begun to study the best practices that are in use by various centers.","Stephen Jackson, professor of clinical gerontology at King's College, said age discrimination was already happening.",Doctors looking to specialize in gerontology go to Norway to study the seniors there and have found men in their 90s in better shape than some Western men in their 30s.,distribution,nostology,geriatrics
390,plait,"The exports are copra, fungus and straw hats, which the women plait very cleverly.",When using synthetic hair for the braids it's best to plait the hair all the way down to the end.,Gather these together in a rubber band and stitch your false plait to them.,mitten,pleat,pleach
391,decrepit,"The provincial schools, dependent upon so decrepit an alma mater, were suffered to decay.","Edward, though only in his fifty-seventh year, was entering into a premature and decrepit old age, in which he became the prey of unworthy favorites, male and female.","The structure which foreshadowed the beauties of Art Deco architecture is now decrepit, boarded up and marked for demolition.",tawdry,anile,shot
392,resurrect,"Playing board or card games one night a week is one way to have fun; if you want to try something different, resurrect games you enjoyed as a child and pass on the experience to your kids.","If hair is dull, dry, and limp, even the best style can't resurrect it.","While a few bathroom decorating ideas can help resurrect a boring space, even the best decorating tips can't rescue an awkward floor plan or an oddly colored bathtub or sink.",flash,renew,reflourish
393,cordial,It is after all only fizzy water and lime cordial!,"An attempt was made to form an anti-Prussian coalition, but it failed in consequence of the cordial understanding between the German and Russian chancellors.",He also extended cordial greetings to the delegates of these countries.,orange,genuine,agonist
394,atypical,There is no evidence to suggest the use of more than one atypical antipsychotic for any patients.,"For example, polysyllabic words that are atypical of the writer's distinctive voice and typical language might be a hint that he or she has plagiarized a professional website.","Also known as atypical autism, PDD-NOS involves some but not all of the classic autism characteristics.",stingy,otypic,unrepresentative
395,austere,"Richard Shackleton was endowed with a grave, pure and tranquil nature, constant and austere, yet not without those gentle elements that often redeem the drier qualities of his religious persuasion.","He remained an austere republican, refusing to take part in the Napoleonic regime.",Lower impact and a smaller environmental footprint doesn't mean austere.,volatile,naked,severe
396,duplicity,"On many occasions, she'd seen the duplicity and cold manipulation he'd spoken of.",Why is so much of the media blinded by his obvious duplicity?,"And amid the guilt and anxiety, I came to see that duplicity often shows itself forth in semblance of sincerity.",thread,perfidy,dishonesty
397,coxcomb,"That he was a coxcomb and a bore, weak, vain, pushing, curious, garrulous, was obvious to all who were acquainted with him.","There is a legend that William Pitt the younger thought of her; the somewhat notorious lover of Mlle de Lespinasse, Guibert, a cold-hearted coxcomb of some talent, certainly paid her addresses.","Though no man was ever more free from anything like the egoism of the intellectual coxcomb, yet he abounded in that active self-confidence and self-assertion which is natural in men who are conscious of great powers, and strenuous in promoting great causes.",vase,knut,fop
398,exact,"We need an exact location too, within fifty or a hundred feet.",Her cell phone rang at the exact time she was certain that her head would burst.,"The exact size of the city is not known, but it probably extended as far as the present north wall of Jerusalem and included the northern part of the western hill.",shaggy,precise,strict
399,compendium,"A useful handbook of Swedenborg's theology is the Compendium of the Theological Writings of Emanuel Swedenborg by the Rev. Samuel Warren (London, 1885).","In this as in the previous studies a compendium is learned by heart, and explanations are given from commentaries and noted down by the students word for word.","The Speculum Majus, the great compendium of all the knowledge of the middle ages, as it left the pen of Vincent, seems to have consisted of three parts only, viz.",quince,schemata,rundown
400,auxiliary,"The brakes are magnetic, with auxiliary handbrakes.",There was a strong ' support team ' not only of psychiatrists and psychiatric social workers but also of auxiliary staff.,"Steam heating, dry or live, is employed alone and also as an auxiliary to direct firing.",momentous,assistant,adminicle
401,summation,"The practical bearings of a science, it will be granted, are simply, as it were, the summation of its facts, with the legitimate conclusions from them, the natural application of the data ascertained, and have not necessarily any direct relationship to its pursuit.","The second is termed by Helmholtz the difference tone, and the third the summation tone.",A similar proof using discrete Abel summation delivers a variant of the theorem in terms of ls instead of li.,flag,total,recapitulation
402,sonnet,The laudatory sonnet composed by James VI.,"As a sonnet writer none stands higher than Paul Szemere, known also for his rendering of Korner's drama Zrinyi (1818), and his contributions to the Elet es Literatura (Life and Literature).","Pier della Vigna there wrote the first sonnet, and Italian lyrics by Frederick himself are preserved to us.",growth,poem,ode
403,patriarch,The seat at the head of the table is always saved for the patriarch of the family.,The Coptic patriarch uses an iron cross-staff.,"The republic managed the tithes, and the clergy acknowledged no chief above their own patriarch.",cabbage,graybeard,paterfamilias
404,battalion,"When they want something, they act like a tank battalion and go get it.",A battalion of marines is stationed here.,"But the forces which had landed at "" W "" and "" X "" beaches had joined hands, the one battalion detailed for "" S "" beach had secured a good position, and during the night the troops still left aboard the "" River Clyde "" contrived to disembark.",body,pack,force
405,amputate,"They don't behead people, or amputate hands, or stone adulterers just for the fun of it.","The surgeon should then wait until the ""line of demarcation,"" linear ulceration, between the living and the dead part is evident,, and then, if the case permits, should amputate at a higher level..","We can measure his heart rhythms, take his blood pressure and even amputate a limb.",sew,remove,cut
406,integral,"It might be trivial, but it was an integral part of their marriage.",This is the binomial theorem for a positive integral index.,Your specific goals are integral to the path you choose to take.,uninterested,whole,intact
407,anchor,You'd just loop your line through a set up or a fixed anchor and rappel down.,"An ""anchor ring"" or ""tore"" results when a circle revolves about an axis in its plane.",According to Strabo he was the first to invent an anchor with two flukes.,brass,nail,kelleg
408,gist,This must have been the gist of the special revelation.,"Hart in The Jewish Quarterly Review for July 1907, the gist of which is that Jesus commends the Pharisees for insisting that when a man has vowed a vow to God he should pay it even though his parents should suffer.",In reviewing an incident so important in the history of the Transvaal as the appointment of the Potchefstroom assembly it is of interest to note the gist of the complaint among the Boers which led to this revolution in the government of the country as it had previously existed.,observation,substance,kernel
409,genus,"They are the starfish proper, and have the typical genus Asterias.",The genus is associated with one long extinct in Europe.,"By early writers the word was generally given as an equivalent of the Linnaean Loxia, but that genus has been found to include many forms not now placed in the same family.",wrist,race,knee
410,listless,"The troops, meanwhile, stood growing listless and dispirited.","She stared at him through listless eyes, the gaze of a human awaiting only the final step in the transformation process.","The people remained listless, giving no indications of any eager dislike of the government policy.",nauseating,downhearted,languid
411,flirt,I think it is so cute the way you two flirt with each other.,And that didn't stop the tall sex maniac trying to flirt with you.,You can easily step up your flirt factor by making your eyes more beautiful.,lay,play,tease
412,obtrude,"Unwilling to obtrude himself on the princess, Rostov did not go back to the house but remained in the village awaiting her departure.","In 1835 he visited the Lakes, and saw much of Hartley Coleridge, but would not ""obtrude on the great man at Rydal,"" although ""Wordsworth was hospitably disposed.""",The rear sight should not obtrude anymore than necessary above the weapon itself.,stride,interfere,enforce
413,heedless,This was a heedless piece of chivalry on Edward's part.,"But that man, so heedless of his words, did not once during the whole time of his activity utter one word inconsistent with the single aim toward which he moved throughout the whole war.","But the world goes on in its life, heedless of the demands of virtue.",puzzled,unobservant,forgetful
414,acetic,It is soluble in water and possesses an odour resembling that of acetic acid.,"It is somewhat readily oxidized; nitric acid gives carbonic and oxalic acids, and chromic acid, carbonic and acetic acids.","According to this theory a "" chemical type "" embraced compounds containing the same number of equivalents combined in a like manner and exhibiting similar properties; thus acetic and trichloracetic acids, aldehyde and chloral, marsh gas and chloroform are pairs of compounds referable to the same type.",finicky,acetin,vinegary
415,dilapidated,"He continued through the streets and slowed when he reached a dilapidated, boarded-up church on a corner.","They had been concealed in a cellar to prevent their falling into the hands of the book-collecting princes of Pergamum, and were in a very dilapidated condition.","In the near distance, beyond the other dilapidated buildings on the abandoned street, came the sound of small arms laser fire.",fanatical,obsolescent,ramshackle
416,formality,"Dusty was a stickler for formality from his men, while Jule's hemisphere was far more relaxed.","While the number of attendants varies based on the event formality, there will generally be fewer attendants for vow renewal ceremonies.","If you are unsure of the formality of an event and want to be sure you are not over or underdressed, it's usually a good idea to contact your hostess.",competition,etiquette,ceremony
417,grisly,"He is described as a grisly monster with a hundred dragons' heads, who was conquered and cast into Tartarus by Zeus.","Nearly every culture on the planet, in one form or another, has a myth about a man that can turn into a grisly beast - the Werewolf.","The grisly scene leading to the condos likely dissuaded anyone from visiting, she rationalized.",noxious,serious,acute
418,entrance,We have a pretty close time frame of entrance and exit.,It was the sunlight streaming in at the entrance to the passage.,She drove up to the elevator entrance on the side of the draw.,income,portal,threshold
419,cogent,The cogent arguments against this view are set forth in the article on Arthropoda.,"However, Dean possessed no cogent thoughts on what to do with this new information.",Thus to take the preface as a distinct word is not reasonable unless there are cogent grounds for uniting the commandments against polytheism and idolatry.,dull,powerful,forceful
420,abortive,The invasion of the Goths and the death of Decius put an end to the abortive attempt.,Abortive medications are taken with the onset of the first sign of a migraine.,"The spreading branches have a tendency to assume a tortuous form, owing to the central shoots becoming abortive, and the growth thus being continued laterally, causing a zigzag development, more exaggerated in old trees and those standing in From Kotschy, op. cit.",unfruitful,losing,failing
421,ulterior,"C. Fuller, who succeeded Sir Donald Stewart as chief commissioner early in 1905, was able to report in the following year that among the Ashanti suspicion of the ""white man's"" ulterior motives was speedily losing ground.",Today we are less happy with such ulterior purposes.,Could Tony have had an ulterior motive - to allow the Tories time to gather strength to take on Gordon?,unknown,future,covert
422,wistful,I was tired but happy and a little wistful when we finally arrived home.,The slightly wistful but rocking London Calling heralded a new direction for the band and a more USA feel to them.,"Faith is not a wistful longing, or a blind confidence, or even "" inward conviction.",pleasant,desired,sick
423,expository,"His works, mainly expository and polemical, have not been collected.",Love letters are long expository moments in a conversation.,Levels are bookended by short expository cut scenes in which our mostly silent heroes use Lego body language and facial expressions to keep us up on the action.,curious,illustrative,explanatory
424,collate,A database needs to be set up to collate information on abandoned hydrants.,"However, local authorities would probably continue to collate the statistics on a quarterly basis.","To collate the whole of the material accumulated at different parts of the world is a much more difficult task; it requires first of all a most carefully constructed star-catalogue, upon which the further discussion may be built.",maintain,check,collect
425,sensitization,Field workers exposed to Bt spray experienced allergic skin sensitization and induction of IgE and IgG antibodies to the spray [19] .,"Some addicts develop a special kind of sensitization, so that even small doses bring a high risk of seizures.","However, an anaphylactoid reaction can occur on initial exposure to an allergen as well as on subsequent exposures, since no sensitization is required.",tendency,allergy,familizarization
426,discriminate,"If she was qualified, why should he discriminate against his daughter?",It is unethical to discriminate against people because of their culture or gender.,Among the innumerable categories applicable to the phenomena of human life one may discriminate between those in which substance prevails and those in which form prevails.,drill,distinguish,separate
427,efficacy,He was a firm believer in the efficacy of culture.,"Suarez endeavoured to reconcile this view with the more orthodox doctrines of the efficacy of grace and special election, maintaining that, though all share in an absolutely sufficient grace, there is granted to the elect a grace which is so adapted to their peculiar dispositions and circumstances that they infallibly, though at the same time quite freely, yield themselves to its influence.",Many topical applications are of great efficacy.,shock,virtue,influence
428,aristocracy,"In this way, Qwing to the dislocation of the ancient aristocracy, to the enlarged jurisdiction,of a power so democratic as the episcopate, and to the increased privileges of the burghs, feudalism received a powerful check in Italy.","It may well be assumed that Lucretius was a member of the Roman aristocracy, belonging either to a senatorian or to one of the great equestrian families.","A religious order, largely composed of immigrants from abroad, could not permanently rule a state which had developed a national feeling of its own; and the native aristocracy, both of the towns and the country, revolted against its dominion.",digestion,nobility,prince
429,vanguard,"At this Congress is represented the vanguard, ready for battle, of workers from all over the world.","In his conception, this liberating social revolution requires for success the leadership of a revolutionary political party of the workers ' vanguard.",It signifies a new revolutionary impulsion to the left on the part of a section of the proletarian vanguard.,wool,pioneer,forefront
430,sluggish,Social life was sluggish in some ways and wild in others.,"The shallowness of the lower stream, where the current is sluggish, is probably due to the great quantities of silt brought down by these floods.",In the student sensuality is a sluggish habit of mind.,repulsive,lazy,depressed
431,bereaved,"Every dead soldier has a face, a story, and a bereaved family.","She is personified as a widowed princess, bereaved and desolate, sitting amid the ruins of her former joys, and brooding over her calamities.","During this time Rome was horrorstruck by the mysterious murder of the young duke of Gandia, and the bereaved pope mourned his son with the wildest grief.",tangy,lost,grieving
432,vile,I had to leave the room because of that vile smell.,His vile mood today has made him an unpleasant person to be around.,She was astonished at the vile curses that came out of his mouth.,heady,evil,mean
433,indigent,Many workhouses have been established for indigent persons capable of work.,He compelled the wealthy to share their riches with the indigent and helpless and to make them their equals in respect of all the comforts and conditions of life.,"An Act of 1910 provides that indigent soldiers, sailors or marines of the U.S. and their families be cared for in their homes and not in almshouses.",petite,poor,needy
434,propagate,"Begin to propagate greenhouse plants by cuttings; also coleuses by cuttings in heat, potting them off as soon as rooted.","Rose was a highchurchman, who to propagate his views in 1832 founded the British Magazine and so came into touch with the leaders of the Oxford movement.","The Bogomils wore garments like mendicant friars and were known as keen missionaries, travelling far and wide to propagate their doctrines.",practise,sread,transmit
435,novice,"In 1726 he entered the Congregation of Missions as a novice, and became a priest in 1726.","As a novice, remember that practice does make perfect.","The Large section had elementary, Starters, Novice and Senior.",carriage,beginner,learner
436,jumble,"He took her hand and led her across the camp, heading for a jumble of rocks.","She stared at the door, a confused jumble of emotions burning her eyes.",But they were merely a meaningless jumble of letters.,debt,chaos,confusion
437,incoherent,The result is a confusion that renders the description incoherent.,"From this vague, incoherent, yet gifted writer our author acquired some of his strong feeling for the naive.","In the midst of his explanation shouts were heard from the army, growing more incoherent and more diffused, mingling with music and songs and coming from the field where the review was held.",aberrant,inconsistent,illogical
438,doze,She read until she started to doze.,Brady's voice awoke her from her uneasy doze a few hours later.,The image accompanying him into a light doze was that of the beautiful woman sleeping in the bed nearby.,apparatus,catnap,drowse
439,extradition,"What about extradition, if a citizen of one country visits another and breaks the local law?","There were treaties between states for the extradition of fugitives, and contracts of mutual assurance between individuals against their loss by flight.","Suleimans demand, however, for extradition or execution was too peremptory for refusal, and the prince was delivered up to the messengers sent to take him.",authority,deportation,repatriation
